{
  "name": "Backyard color rig",
  "camera": "Example 2600MC",
  "telescope": "Example 72mm f/6",
  "sensor_width_pixels": 6248,
  "sensor_height_pixels": 4176,
  "pixel_size_um": 3.76,
  "focal_length_mm": 430,
  "color_state": "cfa",
  "filters": [
    {
      "id": "00000000-0000-4000-8000-000000000040",
      "name": "Dual band",
      "kind": "dual_narrowband",
      "manufacturer": "Example Optics",
      "model": "Duo 7nm",
      "bandpasses": [
        {
          "name": "H-alpha",
          "center_nm": 656.3,
          "width_nm": 7
        },
        {
          "name": "OIII",
          "center_nm": 500.7,
          "width_nm": 7
        }
      ]
    },
    {
      "id": "00000000-0000-4000-8000-000000000041",
      "name": "No filter",
      "kind": "none",
      "bandpasses": [
        {
          "name": "Visible",
          "center_nm": 550
        }
      ]
    }
  ],
  "rotation": "fixed",
  "confirmed_position_angle_degrees": 0
}
